host# lspci -vv -s 03:00.3
03:00.3 Ethernet controller: Intel Corporation Ethernet Controller XL710 for 40GbE QSFP+ (rev 02)
	Subsystem: Oracle/SUN 10 Gb/40 Gb Ethernet Adapter
	Physical Slot: 3
	Control: I/O- Mem+ BusMaster+ SpecCycle- MemWINV- VGASnoop- ParErr- Stepping- SERR+ FastB2B- DisINTx+
	Status: Cap+ 66MHz- UDF- FastB2B- ParErr- DEVSEL=fast >TAbort- <TAbort- <MAbort- >SERR- <PERR- INTx-
	Latency: 0, Cache Line Size: 32 bytes
	Interrupt: pin A routed to IRQ 24
	NUMA node: 0
	Region 0: Memory at c1800000 (64-bit, prefetchable) [size=8M]
	Region 3: Memory at c4000000 (64-bit, prefetchable) [size=32K]
	Expansion ROM at c7000000 [disabled] [size=512K]
	Capabilities: [40] Power Management version 3
		Flags: PMEClk- DSI+ D1- D2- AuxCurrent=0mA PME(D0+,D1-,D2-,D3hot+,D3cold+)
		Status: D0 NoSoftRst+ PME-Enable- DSel=0 DScale=1 PME-
	Capabilities: [50] MSI: Enable- Count=1/1 Maskable+ 64bit+
		Address: 0000000000000000  Data: 0000
		Masking: 00000000  Pending: 00000000
	Capabilities: [70] MSI-X: Enable+ Count=129 Masked-
		Vector table: BAR=3 offset=00000000
		PBA: BAR=3 offset=00001000
	Capabilities: [a0] Express (v2) Endpoint, MSI 00
		DevCap:	MaxPayload 2048 bytes, PhantFunc 0, Latency L0s <512ns, L1 <64us
			ExtTag+ AttnBtn- AttnInd- PwrInd- RBE+ FLReset+ SlotPowerLimit 0.000W
		DevCtl:	Report errors: Correctable- Non-Fatal- Fatal- Unsupported-
			RlxdOrd- ExtTag+ PhantFunc- AuxPwr- NoSnoop- FLReset-
			MaxPayload 256 bytes, MaxReadReq 512 bytes
		DevSta:	CorrErr- UncorrErr- FatalErr- UnsuppReq- AuxPwr- TransPend-
		LnkCap:	Port #0, Speed 8GT/s, Width x8, ASPM L1, Exit Latency L0s <2us, L1 <16us
			ClockPM- Surprise- LLActRep- BwNot- ASPMOptComp+
		LnkCtl:	ASPM Disabled; RCB 64 bytes Disabled- CommClk+
			ExtSynch- ClockPM- AutWidDis- BWInt- AutBWInt-
		LnkSta:	Speed 8GT/s, Width x8, TrErr- Train- SlotClk+ DLActive- BWMgmt- ABWMgmt-
		DevCap2: Completion Timeout: Range ABCD, TimeoutDis+, LTR-, OBFF Not Supported
		DevCtl2: Completion Timeout: 65ms to 210ms, TimeoutDis-, LTR-, OBFF Disabled
		LnkSta2: Current De-emphasis Level: -6dB, EqualizationComplete-, EqualizationPhase1-
			 EqualizationPhase2-, EqualizationPhase3-, LinkEqualizationRequest-
	Capabilities: [e0] Vital Product Data
		Product Name: Oracle 10 Gb/40 Gb Ethernet Adapter
		Read-only fields:
			[PN] Part number: 7319817 Rev.01
			[EC] Engineering changes: H97828-003
			[SN] Serial number: 159048B+17193CFDFEA9127C
			[V1] Vendor specific: Intel Corporation
			[V2] Vendor specific: 8086
			[V3] Vendor specific: 1583
			[V4] Vendor specific: 108E
			[V5] Vendor specific: 7B1D
			[V6] Vendor specific: 5.1W
			[V7] Vendor specific: 0.0W
			[V8] Vendor specific: 0.3W
			[RV] Reserved: checksum good, 0 byte(s) reserved
		Read/write fields:
			[YA] Asset tag: N/A
		End
	Capabilities: [100 v2] Advanced Error Reporting
		UESta:	DLP- SDES- TLP- FCP- CmpltTO- CmpltAbrt- UnxCmplt- RxOF- MalfTLP- ECRC- UnsupReq- ACSViol-
		UEMsk:	DLP- SDES- TLP- FCP- CmpltTO- CmpltAbrt- UnxCmplt- RxOF- MalfTLP- ECRC- UnsupReq+ ACSViol-
		UESvrt:	DLP+ SDES+ TLP- FCP+ CmpltTO+ CmpltAbrt+ UnxCmplt- RxOF+ MalfTLP+ ECRC- UnsupReq+ ACSViol-
		CESta:	RxErr- BadTLP- BadDLLP- Rollover- Timeout- NonFatalErr-
		CEMsk:	RxErr- BadTLP- BadDLLP- Rollover- Timeout- NonFatalErr+
		AERCap:	First Error Pointer: 00, GenCap+ CGenEn- ChkCap+ ChkEn-
	Capabilities: [140 v1] Device Serial Number 7c-12-a9-ff-ff-fe-fd-3c
	Capabilities: [150 v1] Alternative Routing-ID Interpretation (ARI)
		ARICap:	MFVC- ACS-, Next Function: 0
		ARICtl:	MFVC- ACS-, Function Group: 0
	Capabilities: [160 v1] Single Root I/O Virtualization (SR-IOV)
		IOVCap:	Migration-, Interrupt Message Number: 000
		IOVCtl:	Enable- Migration- Interrupt- MSE- ARIHierarchy-
		IOVSta:	Migration-
		Initial VFs: 32, Total VFs: 32, Number of VFs: 0, Function Dependency Link: 03
		VF offset: 109, stride: 1, Device ID: 154c
		Supported Page Size: 00000553, System Page Size: 00000001
		Region 0: Memory at 00000000c3800000 (64-bit, prefetchable)
		Region 3: Memory at 00000000c4020000 (64-bit, prefetchable)
		VF Migration: offset: 00000000, BIR: 0
	Capabilities: [1a0 v1] Transaction Processing Hints
		Device specific mode supported
		No steering table available
	Capabilities: [1b0 v1] Access Control Services
		ACSCap:	SrcValid- TransBlk- ReqRedir- CmpltRedir- UpstreamFwd- EgressCtrl- DirectTrans-
		ACSCtl:	SrcValid- TransBlk- ReqRedir- CmpltRedir- UpstreamFwd- EgressCtrl- DirectTrans-
	Kernel driver in use: vfio-pci
	Kernel modules: i40e



vm# lspci -vv -s 00:04.0
00:04.0 Ethernet controller: Intel Corporation Ethernet Controller XL710 for 40GbE QSFP+ (rev 02)
	Subsystem: Oracle/SUN 10 Gb/40 Gb Ethernet Adapter
	Physical Slot: 4
	Control: I/O- Mem+ BusMaster+ SpecCycle- MemWINV- VGASnoop- ParErr- Stepping- SERR+ FastB2B- DisINTx+
	Status: Cap+ 66MHz- UDF- FastB2B- ParErr- DEVSEL=fast >TAbort- <TAbort- <MAbort- >SERR- <PERR- INTx-
	Latency: 0, Cache Line Size: 32 bytes
	Region 0: Memory at fe000000 (64-bit, prefetchable) [size=8M]
	Region 3: Memory at fe800000 (64-bit, prefetchable) [size=32K]
	Expansion ROM at feb00000 [disabled] [size=512K]
	Capabilities: [40] Power Management version 3
		Flags: PMEClk- DSI+ D1- D2- AuxCurrent=0mA PME(D0+,D1-,D2-,D3hot+,D3cold+)
		Status: D0 NoSoftRst+ PME-Enable- DSel=0 DScale=1 PME-
	Capabilities: [50] MSI: Enable- Count=1/1 Maskable+ 64bit+
		Address: 0000000000000000  Data: 0000
		Masking: 00000000  Pending: 00000000
	Capabilities: [70] MSI-X: Enable+ Count=129 Masked-
		Vector table: BAR=3 offset=00000000
		PBA: BAR=3 offset=00001000
	Capabilities: [a0] Express (v2) Endpoint, MSI 00
		DevCap:	MaxPayload 2048 bytes, PhantFunc 0, Latency L0s <512ns, L1 <64us
			ExtTag+ AttnBtn- AttnInd- PwrInd- RBE+ FLReset+ SlotPowerLimit 0.000W
		DevCtl:	Report errors: Correctable- Non-Fatal- Fatal- Unsupported-
			RlxdOrd- ExtTag+ PhantFunc- AuxPwr- NoSnoop- FLReset-
			MaxPayload 256 bytes, MaxReadReq 512 bytes
		DevSta:	CorrErr- UncorrErr- FatalErr- UnsuppReq- AuxPwr- TransPend-
		LnkCap:	Port #0, Speed 8GT/s, Width x8, ASPM L1, Exit Latency L0s <2us, L1 <16us
			ClockPM- Surprise- LLActRep- BwNot- ASPMOptComp+
		LnkCtl:	ASPM Disabled; RCB 64 bytes Disabled- CommClk+
			ExtSynch- ClockPM- AutWidDis- BWInt- AutBWInt-
		LnkSta:	Speed 8GT/s, Width x8, TrErr- Train- SlotClk+ DLActive- BWMgmt- ABWMgmt-
		DevCap2: Completion Timeout: Range ABCD, TimeoutDis+, LTR-, OBFF Not Supported
		DevCtl2: Completion Timeout: 65ms to 210ms, TimeoutDis-, LTR-, OBFF Disabled
		LnkSta2: Current De-emphasis Level: -6dB, EqualizationComplete-, EqualizationPhase1-
			 EqualizationPhase2-, EqualizationPhase3-, LinkEqualizationRequest-
	Capabilities: [e0] Vital Product Data
		Product Name: Oracle 10 Gb/40 Gb Ethernet Adapter
		Read-only fields:
			[PN] Part number: 7319817 Rev.01
			[EC] Engineering changes: H97828-003
			[SN] Serial number: 159048B+17193CFDFEA9127C
			[V1] Vendor specific: Intel Corporation
			[V2] Vendor specific: 8086
			[V3] Vendor specific: 1583
			[V4] Vendor specific: 108E
			[V5] Vendor specific: 7B1D
			[V6] Vendor specific: 5.1W
			[V7] Vendor specific: 0.0W
			[V8] Vendor specific: 0.3W
			[RV] Reserved: checksum good, 0 byte(s) reserved
		Read/write fields:
			[YA] Asset tag: N/A
		End
	Kernel driver in use: i40e
	Kernel modules: i40e


FlatView #2
 AS "memory", root: system
 AS "cpu-memory-0", root: system
 AS "cpu-memory-1", root: system
 AS "cpu-memory-2", root: system
 AS "cpu-memory-3", root: system
 AS "e1000", root: bus master container
 AS "piix3-ide", root: bus master container
 AS "vfio-pci", root: bus master container
 Root memory region: system
  0000000000000000-000000000009ffff (prio 0, ram): pc.ram
  00000000000a0000-00000000000affff (prio 1, ram): vga.vram
  00000000000b0000-00000000000bffff (prio 1, i/o): vga-lowmem @0000000000010000
  00000000000c0000-00000000000cafff (prio 0, rom): pc.ram @00000000000c0000
  00000000000cb000-00000000000cdfff (prio 0, ram): pc.ram @00000000000cb000
  00000000000ce000-00000000000e7fff (prio 0, rom): pc.ram @00000000000ce000
  00000000000e8000-00000000000effff (prio 0, ram): pc.ram @00000000000e8000
  00000000000f0000-00000000000fffff (prio 0, rom): pc.ram @00000000000f0000
  0000000000100000-00000000bb7fffff (prio 0, ram): pc.ram @0000000000100000
  00000000fd000000-00000000fdffffff (prio 1, ram): vga.vram
  00000000fe000000-00000000fe7fffff (prio 0, ramd): 0000:03:00.3 BAR 0 mmaps[0]
  00000000fe800000-00000000fe80080f (prio 0, i/o): msix-table
  00000000fe800810-00000000fe800fff (prio 0, i/o): 0000:03:00.3 BAR 3 @0000000000000810
  00000000fe801000-00000000fe807fff (prio 0, ramd): 0000:03:00.3 BAR 3 mmaps[0]
  00000000febc0000-00000000febdffff (prio 1, i/o): e1000-mmio
  00000000febf0400-00000000febf041f (prio 0, i/o): vga ioports remapped
  00000000febf0500-00000000febf0515 (prio 0, i/o): bochs dispi interface
  00000000febf0600-00000000febf0607 (prio 0, i/o): qemu extended regs
  00000000fec00000-00000000fec00fff (prio 0, i/o): kvm-ioapic
  00000000fed00000-00000000fed003ff (prio 0, i/o): hpet
  00000000fee00000-00000000feefffff (prio 4096, i/o): kvm-apic-msi
  00000000fffc0000-00000000ffffffff (prio 0, rom): pc.bios


address-space: vfio-pci
  0000000000000000-ffffffffffffffff (prio 0, i/o): bus master container
    0000000000000000-ffffffffffffffff (prio 0, i/o): alias bus master @system 0000000000000000-ffffffffffffffff


memory-region: pci
  0000000000000000-ffffffffffffffff (prio -1, i/o): pci
    00000000000a0000-00000000000affff (prio 2, i/o): alias vga.chain4 @vga.vram 0000000000000000-000000000000ffff
    00000000000a0000-00000000000bffff (prio 1, i/o): vga-lowmem
    00000000000c0000-00000000000dffff (prio 1, rom): pc.rom
    00000000000e0000-00000000000fffff (prio 1, i/o): alias isa-bios @pc.bios 0000000000020000-000000000003ffff
    00000000fd000000-00000000fdffffff (prio 1, ram): vga.vram
    00000000fe000000-00000000fe7fffff (prio 1, i/o): 0000:03:00.3 base BAR 0
      00000000fe000000-00000000fe7fffff (prio 0, i/o): 0000:03:00.3 BAR 0
        00000000fe000000-00000000fe7fffff (prio 0, ramd): 0000:03:00.3 BAR 0 mmaps[0]
    00000000fe800000-00000000fe807fff (prio 1, i/o): 0000:03:00.3 base BAR 3
      00000000fe800000-00000000fe80080f (prio 0, i/o): msix-table
      00000000fe800000-00000000fe807fff (prio 0, i/o): 0000:03:00.3 BAR 3
        00000000fe801000-00000000fe807fff (prio 0, ramd): 0000:03:00.3 BAR 3 mmaps[0]
      00000000fe801000-00000000fe801017 (prio 0, i/o): msix-pba [disabled]
    00000000febc0000-00000000febdffff (prio 1, i/o): e1000-mmio
    00000000febf0000-00000000febf0fff (prio 1, i/o): vga.mmio
      00000000febf0400-00000000febf041f (prio 0, i/o): vga ioports remapped
      00000000febf0500-00000000febf0515 (prio 0, i/o): bochs dispi interface
      00000000febf0600-00000000febf0607 (prio 0, i/o): qemu extended regs
    00000000fffc0000-00000000ffffffff (prio 0, rom): pc.bios
